{
  "version": 1,
  "schema": "hero_tips.schema.json",
  "note": "Community hero tips. Every line here is original text written from the hero's own printed hero-power, or contributed under the repo licence. Never copy another site's guides. See CONTRIBUTING.md for how to add or improve one.",
  "tips": {
    "TB_BaconShop_HERO_16": {
      "name": "A. F. Kay",
      "when": "You are happy to skip turns 1 and 2 for two big minions",
      "bullets": [
        "Nothing to buy until turn 3, so the first fights go badly",
        "The payoff is one Tier 3 and one Tier 4 discover"
      ]
    },
    "TB_BaconShop_HERO_76": {
      "name": "Al'Akir",
      "when": "Your left-most minion is worth building the fight around",
      "bullets": [
        "Only the left-most minion gets it, so positioning IS the power",
        "Windfury doubles its swings; the shield and taunt keep it alive"
      ]
    },
    "TB_BaconShop_HERO_56": {
      "name": "Alexstrasza",
      "when": "Dragons are in and you can climb to Tier 4",
      "bullets": [
        "Does nothing at all before Tier 4",
        "1 gold per Dragon discover once it unlocks"
      ],
      "tribes": [
        "DRAGON"
      ]
    },
    "BG22_HERO_201": {
      "name": "Ambassador Faelin",
      "when": "You can give up turn 1 for picks at Tiers 6, 4 and 2",
      "bullets": [
        "Skipping the first turn costs you the opening fight",
        "The Tier 6 pick only lands if you actually reach Tier 6"
      ]
    },
    "TB_BaconShop_HERO_59": {
      "name": "Aranna Starseeker",
      "when": "You keep a wide board attacking every combat",
      "bullets": [
        "14 friendly attacks is several full fights away",
        "After that, one free minion every turn"
      ]
    },
    "TB_BaconShop_HERO_45": {
      "name": "Arch-Villain Rafaam",
      "when": "You expect to win fights and your minions do the killing",
      "bullets": [
        "1 gold, and it pays nothing if you kill nothing",
        "The copy is plain, so no buffs come with it"
      ]
    },
    "BG31_HERO_802": {
      "name": "Artanis",
      "when": "You buy a lot of cards rather than rolling",
      "bullets": [
        "The reward lands after 14 purchases, not on a fixed turn",
        "You choose which of the two you want at the start of the game"
      ]
    },
    "BG32_HERO_002": {
      "name": "Buttons",
      "when": "You can hold gold on turn 8 for a trinket you choose",
      "bullets": [
        "You pick the Greater Trinket instead of taking what shows up",
        "You still pay for it, so budget that turn"
      ]
    },
    "TB_BaconShop_HERO_29": {
      "name": "C'Thun",
      "when": "You use the power every single turn from turn 1",
      "bullets": [
        "Each use adds a repeat, so it is weak early and huge late",
        "1 gold every turn competes directly with buying"
      ]
    },
    "BG26_HERO_101": {
      "name": "Cap'n Hoggarr",
      "when": "Pirates are in the lobby",
      "bullets": [
        "Each Pirate you buy hands 1 gold straight back",
        "Chaining Pirate buys in one turn is the whole plan"
      ],
      "tribes": [
        "PIRATE"
      ]
    },
    "TB_BaconShop_HERO_64": {
      "name": "Captain Eudora",
      "when": "You can spare 1 gold a turn for four turns",
      "bullets": [
        "Four digs, then a Golden minion - a fixed, known payout",
        "The gold is spent early, when tempo is tightest"
      ]
    },
    "TB_BaconShop_HERO_67": {
      "name": "Captain Hooktusk",
      "when": "You have a weak minion you would rather re-roll",
      "bullets": [
        "The discover is one Tier BELOW the minion you remove",
        "Free to use, so it works on a broke turn"
      ]
    },
    "BG21_HERO_000": {
      "name": "Cariel Roame",
      "when": "You want free stats every turn on any board",
      "bullets": [
        "0 gold, so it never competes with buying",
        "The target is random - a smaller board aims it better"
      ]
    },
    "TB_BaconShop_HERO_78": {
      "name": "Chenvaala",
      "when": "Elementals are in and you want to climb tiers fast",
      "bullets": [
        "Every 3 Elementals PLAYED cuts 3 gold off the next upgrade",
        "Cheap Elementals count the same as good ones"
      ],
      "tribes": [
        "ELEMENTAL"
      ]
    },
    "BGDUO_HERO_222": {
      "name": "Cho",
      "when": "Duos, and you can make three Golden minions",
      "bullets": [
        "Both players get the Triple Reward, so each Golden pays twice",
        "Only three uses - spend them on Goldens you were making anyway"
      ]
    },
    "BG21_HERO_020": {
      "name": "Cookie the Cook",
      "when": "You have spare minions of the types you want to draw",
      "bullets": [
        "The discover comes from the TYPES you fed it, so feed on purpose",
        "You lose the three minions you throw in"
      ]
    },
    "TB_BaconShop_HERO_36": {
      "name": "Dancin' Deryl",
      "when": "You buy and sell minions constantly",
      "bullets": [
        "Every minion you play arrives with a permanent +1/+1 hat",
        "Selling passes the hat on instead of losing it"
      ]
    },
    "BG20_HERO_103": {
      "name": "Death Speaker Blackthorn",
      "when": "Quilboar are in the lobby",
      "bullets": [
        "Two charges a turn, 1 gold each, for 4 Blood Gems",
        "Blood Gems only matter with Quilboar payoffs on board"
      ],
      "tribes": [
        "QUILBOAR"
      ]
    },
    "TB_BaconShop_HERO_52": {
      "name": "Deathwing",
      "when": "You want a fast, violent lobby",
      "bullets": [
        "The +2 Attack hits ALL minions - the enemy board too",
        "It stacks every combat, so health matters more than usual"
      ]
    },
    "TB_BaconShop_HERO_43": {
      "name": "Dinotamer Brann",
      "when": "You are buying Battlecry minions anyway",
      "bullets": [
        "Only Battlecry minions count toward the four",
        "One free Brann, once per game - then the power is spent"
      ]
    },
    "BG28_HERO_801": {
      "name": "Doctor Holli'dae",
      "when": "You can spend 1 gold a turn on a random Tavern spell",
      "bullets": [
        "The spell is random, so this is value, not a plan",
        "A turn you cannot spare the gold is a turn with no power"
      ]
    },
    "BG22_HERO_002": {
      "name": "Drek'Thar",
      "when": "You keep a board slot open and one huge attacker",
      "bullets": [
        "Nothing happens before turn 7",
        "No empty slot in combat means no copy at all"
      ]
    },
    "BG25_HERO_105": {
      "name": "E.T.C., Band Manager",
      "when": "You have 3 spare gold for an extra minion pick",
      "bullets": [
        "Locked until Tier 2",
        "3 gold is a whole minion, so use it on gold-rich turns"
      ]
    },
    "TB_BaconShop_HERO_01": {
      "name": "Edwin VanCleef",
      "when": "You want one minion carrying the whole board",
      "bullets": [
        "The buff grows as you buy cards, so buying is part of the power",
        "1 gold for permanent stats, any minion"
      ]
    },
    "TB_BaconShop_HERO_42": {
      "name": "Elise Starseeker",
      "when": "You want a guaranteed pick at your current Tier",
      "bullets": [
        "Each use costs 1 more than the last, so it is strongest early",
        "It discovers at YOUR Tier - upgrade first, then use it"
      ]
    },
    "BG24_HERO_204": {
      "name": "Enhance-o Mechano",
      "when": "You refresh the tavern often",
      "bullets": [
        "Two tavern minions get a random keyword on every refresh",
        "The keyword is wasted unless you buy that minion"
      ]
    },
    "BG31_HERO_006": {
      "name": "Exarch Othaar",
      "when": "You buy Tavern spells regularly",
      "bullets": [
        "One discounted spell at a time, not every spell",
        "Worth nothing if you never buy spells"
      ]
    },
    "BG31_HERO_003": {
      "name": "Farseer Nobundo",
      "when": "You cast strong Tavern spells and want them twice",
      "bullets": [
        "It copies the LAST spell you cast, so cast in the right order",
        "Starts at 3 gold and gets 1 cheaper each turn you wait"
      ]
    },
    "BGDUO_HERO_101": {
      "name": "Flobbidinous Floop",
      "when": "Duos, and your teammate is on a higher Tier than you",
      "bullets": [
        "The transform lasts the combat only",
        "Point it at your weakest minion"
      ]
    },
    "BG32_HERO_001": {
      "name": "Forest Lord Cenarius",
      "when": "You expect a long game and want to break the gold cap",
      "bullets": [
        "3 gold now for 1 extra gold every turn after",
        "Dying early means it never pays back"
      ]
    },
    "TB_BaconShop_HERO_74": {
      "name": "Forest Warden Omu",
      "when": "You plan to upgrade the tavern every turn you can",
      "bullets": [
        "Every upgrade refunds 2 gold, so climbing is far cheaper",
        "A turn with no upgrade is a turn with no power"
      ]
    },
    "TB_BaconShop_HERO_55": {
      "name": "Fungalmancer Flurgl",
      "when": "Murlocs are in the lobby",
      "bullets": [
        "Selling is the trigger, so buy and sell freely",
        "The Murloc you get is random"
      ],
      "tribes": [
        "MURLOC"
      ]
    },
    "TB_BaconShop_HERO_02": {
      "name": "Galakrond",
      "when": "You want a minion from above your Tavern Tier",
      "bullets": [
        "1 gold puts a higher-Tier card in the tavern; you still buy it",
        "Best on a turn you were going to spend anyway"
      ]
    },
    "BGDUO_HERO_223": {
      "name": "Gall",
      "when": "Duos, and you can make three Golden minions",